questionid,correct_answer,options,question_name,quizzesid
1,C,"A. に/B. で/C. を/D. へ","どこ_____いきますか？",1
2,A,"A. です/B. ます/C. います/D. あります","私は学生_____。",1
3,A,"A. 読んで/B. 読みて/C. 読む/D. 読み","本を_____います。",1
4,B,"A. Mèo/B. Chó/C. Chim/D. Cá","'いぬ' là gì?",2
5,B,"A. Chó/B. Mèo/C. Chim/D. Cá","'ねこ' là gì?",2
6,C,"A. Cá/B. Mèo/C. Chim/D. Chó","'とり' là gì?",2
7,A,"A. Ăn/B. Uống/C. Nhìn/D. Nghe","食 nghĩa là gì?",3
8,B,"A. Ăn/B. Uống/C. Nhìn/D. Nghe","飲 nghĩa là gì?",3
9,C,"A. Uống/B. Ăn/C. Nhìn/D. Nghe","見 nghĩa là gì?",3 